{
  "$schema": "https://json-schema.org/draft/2020-12/schema",
  "title": "RawOffer",
  "type": "object",
  "required": [
    "offer_id",
    "supplier",
    "supplier_sku",
    "product_name",
    "price",
    "currency",
    "captured_at",
    "valid_until"
  ],
  "properties": {
    "offer_id": {"type": "string"},
    "supplier": {"type": "string"},
    "supplier_sku": {"type": "string"},
    "product_name": {"type": "string"},
    "category": {"type": "string"},
    "tier": {"type": "string", "enum": ["standard", "premium"]},
    "pack_size": {"type": "number"},
    "pack_unit": {"type": "string"},
    "price": {"type": "number"},
    "price_per_base_unit": {"type": ["number", "null"]},
    "currency": {"type": "string"},
    "vat_rate": {"type": ["number", "null"]},
    "captured_at": {"type": "string", "format": "date-time"},
    "valid_until": {"type": "string", "format": "date-time"},
    "source": {"type": "string"},
    "in_stock": {"type": "boolean"},
    "notes": {"type": "string"}
  }
}
