[
  {
    "offer_id": "OFF-TM-DEMO-001",
    "supplier": "TheMart",
    "supplier_sku": "TM-DEMO-TOMATO",
    "product_name": "Tomato Demo",
    "category": "produce",
    "tier": "standard",
    "pack_size": 1,
    "pack_unit": "kg",
    "price": 2.0,
    "price_per_base_unit": 2.0,
    "currency": "EUR",
    "vat_rate": 0.13,
    "captured_at": "2026-02-12T05:30:00+00:00",
    "valid_until": "2026-02-26T05:30:00+00:00",
    "in_stock": true
  },
  {
    "offer_id": "OFF-ALI-DEMO-001",
    "supplier": "Alios",
    "supplier_sku": "",
    "product_name": "Tomato Demo",
    "category": "produce",
    "tier": "standard",
    "pack_size": 1,
    "pack_unit": "kg",
    "price": 1.8,
    "price_per_base_unit": 1.8,
    "currency": "EUR",
    "vat_rate": 0.13,
    "captured_at": "2026-02-12T05:30:00+00:00",
    "valid_until": "2026-02-26T05:30:00+00:00",
    "in_stock": true
  },
  {
    "offer_id": "OFF-TM-DEMO-002",
    "supplier": "TheMart",
    "supplier_sku": "TM-DEMO-TUNA",
    "product_name": "Tuna Demo",
    "category": "seafood",
    "tier": "standard",
    "pack_size": 1,
    "pack_unit": "kg",
    "price": 13.5,
    "price_per_base_unit": 13.5,
    "currency": "EUR",
    "vat_rate": 0.13,
    "captured_at": "2026-02-12T05:30:00+00:00",
    "valid_until": "2026-02-26T05:30:00+00:00",
    "in_stock": true
  },
  {
    "offer_id": "OFF-ALI-DEMO-002",
    "supplier": "Alios",
    "supplier_sku": "ALI-DEMO-TUNA",
    "product_name": "Tuna Demo",
    "category": "seafood",
    "tier": "standard",
    "pack_size": 1,
    "pack_unit": "kg",
    "price": 14.0,
    "price_per_base_unit": 14.0,
    "currency": "EUR",
    "vat_rate": 0.13,
    "captured_at": "2026-02-12T05:30:00+00:00",
    "valid_until": "2026-02-26T05:30:00+00:00",
    "in_stock": true
  },
  {
    "offer_id": "OFF-TM-DEMO-003",
    "supplier": "TheMart",
    "supplier_sku": "TM-DEMO-EDA",
    "product_name": "Edamame Demo",
    "category": "frozen",
    "tier": "standard",
    "pack_size": 1,
    "pack_unit": "kg",
    "price": 3.0,
    "price_per_base_unit": 3.0,
    "currency": "EUR",
    "vat_rate": 0.13,
    "captured_at": "2026-02-12T05:30:00+00:00",
    "valid_until": "2026-02-26T05:30:00+00:00",
    "in_stock": true
  },
  {
    "offer_id": "OFF-ALI-DEMO-003",
    "supplier": "Alios",
    "supplier_sku": "ALI-DEMO-EDA",
    "product_name": "Edamame Demo",
    "category": "frozen",
    "tier": "standard",
    "pack_size": 1,
    "pack_unit": "kg",
    "price": 3.2,
    "price_per_base_unit": 3.2,
    "currency": "EUR",
    "vat_rate": 0.13,
    "captured_at": "2026-02-12T05:30:00+00:00",
    "valid_until": "2026-02-26T05:30:00+00:00",
    "in_stock": true
  },
  {
    "offer_id": "OFF-TM-DEMO-004",
    "supplier": "TheMart",
    "supplier_sku": "TM-DEMO-SOY",
    "product_name": "Soy Sauce Demo",
    "category": "dry",
    "tier": "standard",
    "pack_size": 1,
    "pack_unit": "lt",
    "price": 6.0,
    "price_per_base_unit": 6.0,
    "currency": "EUR",
    "vat_rate": 0.13,
    "captured_at": "2026-02-12T05:30:00+00:00",
    "valid_until": "2026-02-26T05:30:00+00:00",
    "in_stock": true
  },
  {
    "offer_id": "OFF-ALI-DEMO-004",
    "supplier": "Alios",
    "supplier_sku": "ALI-DEMO-SOY",
    "product_name": "Soy Sauce Demo",
    "category": "dry",
    "tier": "standard",
    "pack_size": 1,
    "pack_unit": "lt",
    "price": 6.5,
    "price_per_base_unit": 6.5,
    "currency": "EUR",
    "vat_rate": 0.13,
    "captured_at": "2026-02-12T05:30:00+00:00",
    "valid_until": "2026-02-26T05:30:00+00:00",
    "in_stock": true
  }
]
