[
  {
    "offer_id": "OFF-TM-20260212-0005",
    "supplier": "TheMart",
    "supplier_sku": "",
    "product_name": "Iceberg εισαγωγής",
    "category": "produce",
    "tier": "standard",
    "pack_size": 1,
    "pack_unit": "kg",
    "price": 2.09,
    "price_per_base_unit": 2.09,
    "currency": "EUR",
    "vat_rate": 0.13,
    "captured_at": "2026-02-12T05:37:56.808143+00:00",
    "valid_until": "2026-02-26T05:37:56.808143+00:00",
    "source": "import_csv:themart_round1.csv",
    "in_stock": true,
    "notes": ""
  },
  {
    "offer_id": "OFF-ALI-20260212-0006",
    "supplier": "Alios",
    "supplier_sku": "",
    "product_name": "Wasabi Paste, 43g, Yutaka – China",
    "category": "produce",
    "tier": "standard",
    "pack_size": 1,
    "pack_unit": "kg",
    "price": 1.75,
    "price_per_base_unit": 1.75,
    "currency": "EUR",
    "vat_rate": 0.13,
    "captured_at": "2026-02-12T05:37:56.882714+00:00",
    "valid_until": "2026-02-26T05:37:56.882714+00:00",
    "source": "import_csv:alios_round1_real_import.csv",
    "in_stock": true,
    "notes": ""
  },
  {
    "offer_id": "OFF-TM-20260212-0002",
    "supplier": "TheMart",
    "supplier_sku": "",
    "product_name": "Blueberries εισαγωγής (125g)",
    "category": "seafood",
    "tier": "standard",
    "pack_size": 1,
    "pack_unit": "kg",
    "price": 1.25,
    "price_per_base_unit": 1.25,
    "currency": "EUR",
    "vat_rate": 0.13,
    "captured_at": "2026-02-12T05:37:56.808143+00:00",
    "valid_until": "2026-02-26T05:37:56.808143+00:00",
    "source": "import_csv:themart_round1.csv",
    "in_stock": true,
    "notes": ""
  },
  {
    "offer_id": "OFF-ALI-20260212-0025",
    "supplier": "Alios",
    "supplier_sku": "",
    "product_name": "Edamame ENSO, whole pods, blanched – China",
    "category": "seafood",
    "tier": "standard",
    "pack_size": 1,
    "pack_unit": "kg",
    "price": 1.39,
    "price_per_base_unit": 1.39,
    "currency": "EUR",
    "vat_rate": 0.13,
    "captured_at": "2026-02-12T05:37:56.882714+00:00",
    "valid_until": "2026-02-26T05:37:56.882714+00:00",
    "source": "import_csv:alios_round1_real_import.csv",
    "in_stock": true,
    "notes": ""
  },
  {
    "offer_id": "OFF-TM-20260212-0001",
    "supplier": "TheMart",
    "supplier_sku": "",
    "product_name": "Blackberries εισαγωγής (125g)",
    "category": "frozen",
    "tier": "standard",
    "pack_size": 1,
    "pack_unit": "kg",
    "price": 3.07,
    "price_per_base_unit": 3.07,
    "currency": "EUR",
    "vat_rate": 0.13,
    "captured_at": "2026-02-12T05:37:56.808143+00:00",
    "valid_until": "2026-02-26T05:37:56.808143+00:00",
    "source": "import_csv:themart_round1.csv",
    "in_stock": true,
    "notes": ""
  },
  {
    "offer_id": "OFF-ALI-20260212-0010",
    "supplier": "Alios",
    "supplier_sku": "",
    "product_name": "Ginger pickled, 1kg, Gari pink, Enso - China AA GRADE",
    "category": "frozen",
    "tier": "standard",
    "pack_size": 1,
    "pack_unit": "kg",
    "price": 2.68,
    "price_per_base_unit": 2.68,
    "currency": "EUR",
    "vat_rate": 0.13,
    "captured_at": "2026-02-12T05:37:56.882714+00:00",
    "valid_until": "2026-02-26T05:37:56.882714+00:00",
    "source": "import_csv:alios_round1_real_import.csv",
    "in_stock": true,
    "notes": ""
  }
]