[
  {"offer_id":"OFF-TM-P30-1","supplier":"TheMart","supplier_sku":"TM-P30-TOM","product_name":"Tomato P30","category":"produce","tier":"standard","pack_size":1,"pack_unit":"kg","price":2.0,"price_per_base_unit":2.0,"currency":"EUR","vat_rate":0.13,"captured_at":"2026-02-12T06:20:00+00:00","valid_until":"2026-02-26T06:20:00+00:00","in_stock":true},
  {"offer_id":"OFF-ALI-P30-1","supplier":"Alios","supplier_sku":"ALI-P30-TOM","product_name":"Tomato P30","category":"produce","tier":"standard","pack_size":1,"pack_unit":"kg","price":1.9,"price_per_base_unit":1.9,"currency":"EUR","vat_rate":0.13,"captured_at":"2026-02-12T06:20:00+00:00","valid_until":"2026-02-26T06:20:00+00:00","in_stock":true},
  {"offer_id":"OFF-TM-P30-2","supplier":"TheMart","supplier_sku":"TM-P30-TUN","product_name":"Tuna P30","category":"seafood","tier":"standard","pack_size":1,"pack_unit":"kg","price":10.0,"price_per_base_unit":10.0,"currency":"EUR","vat_rate":0.13,"captured_at":"2026-02-12T06:20:00+00:00","valid_until":"2026-02-26T06:20:00+00:00","in_stock":true},
  {"offer_id":"OFF-ALI-P30-2","supplier":"Alios","supplier_sku":"ALI-P30-TUN","product_name":"Tuna P30","category":"seafood","tier":"standard","pack_size":1,"pack_unit":"kg","price":10.5,"price_per_base_unit":10.5,"currency":"EUR","vat_rate":0.13,"captured_at":"2026-02-12T06:20:00+00:00","valid_until":"2026-02-26T06:20:00+00:00","in_stock":true},
  {"offer_id":"OFF-TM-P30-3","supplier":"TheMart","supplier_sku":"TM-P30-NOR","product_name":"Nori P30","category":"dry","tier":"standard","pack_size":1,"pack_unit":"pcs","price":6.0,"price_per_base_unit":6.0,"currency":"EUR","vat_rate":0.13,"captured_at":"2026-02-12T06:20:00+00:00","valid_until":"2026-02-26T06:20:00+00:00","in_stock":true},
  {"offer_id":"OFF-ALI-P30-3","supplier":"Alios","supplier_sku":"ALI-P30-NOR","product_name":"Nori P30","category":"dry","tier":"standard","pack_size":1,"pack_unit":"pcs","price":5.8,"price_per_base_unit":5.8,"currency":"EUR","vat_rate":0.13,"captured_at":"2026-02-12T06:20:00+00:00","valid_until":"2026-02-26T06:20:00+00:00","in_stock":true}
]
